title,artist,lyricist,composer,arranger,lyrics
こんなに好きになっちゃっていいの？,日向坂46,秋元康,前迫潤哉・7th Avenue,7th Avenue,こんなに　ねえこんなに好きになっちゃっていいの？　ふと気づくと一日中　あなたを想ってる　頬にはらはらと　涙が溢れるのはなぜでしょう？　恋するって切ない　　さっきまでそこにいた　猫を探したくなるように　いつの間にかあなたが　私の中心になってしまった　　占いとか信じてないのに調べてみた　今の私はどう思われてる？　いつも(いつも)気に掛かる(気に掛かる)　愛はきりがない　It's like infinity　　こんなに　ねえこんなに好きになっちゃっていいの？　もう何も見えてない　自分が怖くなるのよ　誰に止められてもブレーキを掛けられない　わがままなこの愛しさ　その突き当たりは何が待っているのでしょうか　どうしたって嫌いになんてなれない　まわりのすべてを失おうとあなただけ好きでいる　　親友に何時間　話しても話し足りない　あなたが言った言葉　深読みなんかしても意味ないのに…　　窓に映る　自分を見つめて不安になる　こんなに弱い私じゃなかった　誰の(誰の)せいでしょう(せいでしょう)　愛が振り回す　Love is up to infinity　　こんなに　そうこんなに好きになっちゃえたなんて　初めてのことだから　自分がわからなくなる　理屈なんかでは感情を抑えられないの　不器用なこの一途さ　好きになりすぎた私は傷つくのでしょうか？　もう　それでも出会う前に戻れない　他には何も欲しくはない　あなただけいればいい　　そんな人と巡り会えたなんて　奇跡だとわかってるわ　何が(何が)　あってもいい(あってもいい)　だから永遠に　Cause you're till infinity　　こんなに　ねえこんなに好きになっちゃっていいの？　もう何も見えてない　自分が怖くなるのよ　誰に止められてもブレーキを掛けられない　わがままなこの愛しさ　その突き当たりは何が待っているのでしょうか　どうしたって嫌いになんてなれない　まわりのすべてを失おうとあなただけ好きでいる
ゴーフルと君,日向坂46,秋元康,辻村有記・伊藤賢,伊藤賢・辻村有記,なぜだか　ずっと思い出せなかった　過ぎて行く月日に押し流されたもの　真っ青な空　窓から見える日曜日の午後　アールグレイを飲みながら　いろいろ考えたこと　　僕にとって　とても大事な時間だったのに　そんなあっさり　忘れていいのか　　あれは　“ゴーフル”という名のお菓子だ　丸くて薄いフランス生まれ　ワッフルみたいな　凸凹(でこぼこ)模様の焼き菓子　あんなに好きだったものが　すぐには名前も出て来ない　記憶に蓋してるのかな　君を思い出さぬように…　　サクッサクッとした　あの食感が大好きだった　しつこくない甘さもバター風味も…　どんなに食べたってお腹に溜まらない　君はいつもそう言って手を伸ばしたね　　何が愛か　何がやさしさなのか分からずに　僕はいつしか大人になった　　急に“ゴーフル”食べたくなったんだ　あれから食べてなかったけれど　どうしてなんだろう　懐かしさだけじゃないはず　誰かを好きになることは　ふとした時に気づくことだ　日常の中に埋まってく　気持ちを見つけてハッとする　　“ゴーフル”を食べているうちに　テーブルの下に落ちた　“ゴーフル”の破片(かけら)もなぜか愛おしいくらい　あの頃　目にした全て　かけがえないものと　今になれば理解できるんだ　誰を好きになったかよりも　その時に昂まる感情よ　忘れていないものは　一番大切　　あれは　“ゴーフル”という名のお菓子だ　丸くて薄いフランス生まれ　ワッフルみたいな　凸凹模様の焼き菓子　あんなに好きだったものが　すぐには名前も出て来ない　記憶に蓋してるのかな　君を思い出さぬように…
三輪車に乗りたい,日向坂46,秋元康,Kaz Kuwamura(CWF)・カトウリョータ(CWF)・小木岳司(CWF),小木岳司・カトウリョータ・Kaz Kuwamura,アパートの前　端に寄せた三輪車は　(忘れられて)　近くに住んでいる子供のものだろう　(迷子みたい)　　青い塗料が落ちたのは　放置した愛のせい　月日は過ぎる　(わがままに)　　僕はここだよ　(大人になってしまったけど)　大きな声で　(何も変わっていないんだ)　叫んでるのに…　(そんなの嘘だとバレているよね)　思い出に乗りたい　小さ過ぎたとしても…　　ひっくり返り　雨ざらしの三輪車が　(寂しそうで)　誰かにとって大事なものだったのに…　(邪魔なだけだ)　　人間(ひと)の気持ちが錆びるのは　しあわせになれすぎて　普通になるから　(ときめきも)　　君はどこなの？　(あれからずっと会っていないし)　あの頃のように　(アパート引っ越したと聞いた)　会いたいけれど　(昔のことなんか興味ないか)　三輪車に乗れない　　街の灯(あか)りがいつのまにか点いている　「もうこんな時間なのかなんて空の気配で気づいて」　影法師の長さがなんだか懐かしかった　何かに夢中になるっていいもんだ　　僕はここだよ　(大人になってしまったけど)　大きな声で　(何も変わっていないんだ)　叫んでるのに…　(そんなの嘘だとバレているよね)　思い出に乗りたい　　君はどこなの？　(あれからずっと会っていないし)　あの頃のように　(アパート引っ越したと聞いた)　会いたいけれど　(昔のことなんか興味ないか)　三輪車に乗れない　　僕はもう子供じゃない　　僕は三輪車のベルを鳴らした
車輪が軋むように君が泣く,日向坂46,秋元康,若田部誠,若田部誠,僕は何を言えばいいのか　こんな自分は嫌いと泣いている君に…　夕陽沈む校舎の屋上　制服でいられるのも　あと数ヶ月くらいだ　　親や教師に止められた　もっと現実を見なさいと…　何か諦めれば楽になる　wow wow　未来　取り上げるのか　　古い列車は古いレールを走って　　古い車輪が軋(きし)む　次の世代は新しいレールの上　夢追いかけ　どこまででも　走れるはず　　君は何に背を向けたのか？　風の中で「ごめん」と聴こえたような…　こんなとこで悩んでるより　教室を飛び出せよとチャイムが鳴り響いた　　人生なんていつだって　何が正しいかわからない　僕ら10年後　どうなるか　wow wow　自分で道を拓(ひら)こう　　だから大人は過ぎた時代を悔やんで　　胸のどこかが軋(きし)む　そんな痛みを残さない過去のために　やりたいこと　やるしかない　回せ車輪　　古い列車は古いレールを走って　　古い車輪が軋(きし)む　次の世代は新しいレールの上　夢追いかけ　どこまででも　走れるはず　　信じるまま　思うままに　回せ車輪
知らないうちに愛されていた,日向坂46,秋元康,BASEMINT,BASEMINT,Woh oh oh oh oh oh oh oh…　　ピアノが聴こえたら　このメロディー　弾くのは誰か？　なぜだか何となく考えてしまうけど…　それより誰のために　そのピアノ弾いているのか？　想像する人なんか　そんないないだろう　　してあげたことだけは覚えてるけど　さりげなくされていたことって　当たり前のようで　すぐに忘れてしまう　　そうなんだ　知らないうちに愛されていたとようやく今　気づいたよ　そんなことも知らずに　君のやさしさに甘えてた　見えないとこで　僕の弱さを全部支えてくれてたのに　君が泣いていたその理由さえも聞かずにごめん　許して欲しい　　Woh oh oh oh oh oh oh oh…　　あれからこの曲が　風に乗り流れて来ると　ピアノを弾いている君を思い出すんだ　別人だってこと　もちろんわかっているけど　遠くに面影を探してしまってる　　傷つけてしまった無神経さ　ほろ苦い記憶が蘇(よみがえ)って　誰もいない場所を　何度も振り返る　　切ないよ　だけど結局　愛想尽かされて　君も去ってしまったね　遠く消える足音　僕は存在にハッとした　失ってから　大切なもの　それが何かわかったってことさ　そんなあやふやな不確かなものが愛って学んだよ　　見えなかったのか　見てなかったのか　若さはいつだって　言い訳ばかり　都合いいように…　　Woh oh oh oh oh oh oh oh…　　その時　僕は愛されてたか　覚えていないはずない　きっと嘘をついている　自分の思い出を書き直して　　そうなんだ　知らないうちに愛されていたとようや　く今　気づいたよ　そんなことも知らずに　君のやさしさ　に甘えてた　見えないとこで　僕の弱さを全部支え　てくれてたのに　君が泣いていたその理由さえも聞かず　にごめん　許して欲しい　　Woh oh oh oh oh oh oh oh…
See Through,日向坂46,秋元康,佐々木裕,佐々木裕,超能力もらっても嬉しくなんかない　余計な荷物背負(しょ)って疲れちゃったよ　　心の中　覗けたら面白そうだって　ぼんやり思ってたらそうなっちゃったんだ　パパとかママとか妹　友達　とにかく　誰だって　目の前に立つだけで今何を考えてるかわかるの　　大好きなあなたまで　手に取るように読めるなんて　自分のこと嫌になる　どうすればいいのでしょうか　善意とか悪意とか　すべてがごちゃまぜになる　複雑な感情　　See Through　見えちゃうよ　See Through　何もかも…　人の気持ちは隠さなきゃダメなんだ　See Through　見たくない　See Through　あれもこれも…　私をどう思っているのか　知りたくなんかなかったのに…　そう　答えはいつでも　そう　未来の向こうよ　Do I wanna know？　YesでもNoでも構わない　I don't wanna know　気持ちがまだわからない　未開封　だから恋　　この世の中　見てはいけないものがあるって　今さら気づいたけど　もう手遅れよ　こんなことだとかあんなことだとか見たくはなかったし　見てしまってからはこの先どうやって生きればいいのか？　　どんな顔してればいい？　あなたと会っている時　白々しい態度かも…　ぎこちなくてごめんなさい　知らんぷりしてたって　違うこと考えたって　自分は欺(あざむ)けない　　Go Through　見えたまま　Go Through　目を閉じず　諦めなけりゃいけないと言うのね？　Go Through　見えながら　Go Through　生きて行くの？　あなたがどう考えてるのか　返事を求めたりしない　ねえ　想定外の　ねえ　愛を教えて　Do you wanna love？　ハグしてもキスしてもしょうがない　I don't wanna love　ドキドキとしたいだけ　未経験　だって恋　　ここから先は　絶対　ああなって　そして　こうなるのよ　何かハプニング　起こって欲しい　　See Through　見えちゃうよ　See Through　何もかも…　人の気持ちは隠さなきゃダメなんだ　See Through　見たくない　See Through　あれもこれも…　私をどう思っているのか　知りたくなんかなかったのに…　そう　答えはいつでも　そう　未来の向こうよ　Do I wanna know？　YesでもNoでも構わない　I don't wanna know　気持ちがまだわからない　未開封　だから恋
シーラカンス,日向坂46,秋元康,barbora・TomoLow,TomoLow,雨の雫　頬に感じた　雑踏の中　空を見上げ　僕が参ったなと思ってた時　　後ろから不意に　傘を差し出す　誰かがいて振り向いたけれど　名前も知らぬ女性だった　　その眼差し　どこかで会ったような　懐かしさは　なぜ？　君は誰ですか？　　シーラカンス　生きた化石のように　ハートの底にいたんだ　ずっと　忘れていたよ　こんなエモい瞬間　　あの頃と変わってない　ときめきを見つけたんだ　まさか　今も　そっと生きてたなんて　奇跡だ　　中学生か　高校生か　ずいぶん前の恋する痛み　話し掛けようとしたら　不意に何か動いた　　カフェのテント　慌てて逃げ込み　雨宿りする僕の隣に　君はなぜいるのか？　傘を持ってるのに…　　なんか変だよね　不思議な感じ　だけどどうしてだろう　悪い気はしない　雨が降り止まなきゃいいのに…　　黙ったまま　何分こうしてたか？　このドキドキは何？どうなってしまうの？　　シーラカンス　今でも生き延びてた　絶滅したわけじゃない　誰も気づかぬように　どこにいたのだろう？　　大人への氷河時代　自然淘汰されないまま　忘れさられ　ここで蘇るとは　ミステリー　　Fu…　　ずっと前に失くしたと思ってた　僕にとって大事なものを　胸の奥で見つけたんだ　ねえなんか嬉しいよ　　シーラカンス　生きた化石のように　ハートの底にいたんだ　ずっと　忘れていたよ　こんなエモい瞬間　　あの頃と変わってない　ときめきを見つけたんだ　まさか　今も　そっと生きてたなんて　奇跡だ　　中学生か　高校生か　ずいぶん前の恋する痛み　話し掛けようとしたら　不意に何か動いた
10秒天使,日向坂46,秋元康,YSU,APAZZI,教室で　さりげなく　飛び交ってる誰かと誰かの視線　気づいたり　全然気づかなかったり　恋とは目に見えない力　　心　何かに引っ張られてる　斜め前の天使よ　　10秒　君のこと見つめてたら　僕はきっと好きになってしまう　だからすぐ目を逸(そ)らして　興味ないふりしてた　弱気な片想い　　10秒　あっという間のことでも　なぜかとても長く感じるよ　何も喋らないまま　僕の胸の切なさを　伝えようとしているんだ　　消しゴムを落とすような　そんな子供っぽい振り向かせ方はしない　遠くから　時々　眺めるだけで　充分　満足なんだよ　　言葉より　もっと　はっきりしてる　恋とはその眼差し　　何秒　君のこと考えずに　僕は平静でいられるだろう　終業チャイムが鳴ったら　窓のカーテン開けて　空を見上げてみる　　何秒　雲の流れ　目で追って　近くにいる君を感じられる？　そんな自分のことが　不器用だと思うけど　君を好きじゃしょうがない　　10秒　君のこと見つめてたら　僕はきっと好きになってしまう　だからすぐ目を逸(そ)らして　興味ないふりしてた　弱気な片想い　　10秒　あっという間のことでも　なぜかとても長く感じるよ　何も喋らないまま　僕の胸の切なさを　伝えようとしているんだ
JOYFUL LOVE,日向坂46,秋元康,前迫潤哉・Dr. Lilcom,Dr.Lilcom,君が微笑むだけで何だって許せてしまうんだ　まるで木漏れ日のように温かい気持ちになれる　　JOYFUL LOVE　これは恋なのか？　wowow　JOYFUL LOVE　初めての世界　wow　　見つめた瞬間　ふいに言葉は邪魔になる　心はとっくに通じているかもしれない　　誰も生きてれば嫌なこととか　傷つくこといくつもあるよ　だけど君と出会ってから変わった　俯(うつむ)くより顔を上げた方が人生は楽しいんだ　　どんな悲しみだって　そっと包み込んでしまうよ　理由(わけ)なんか言わなくても　すべてをわかってくれる　君がしあわせならば　そう僕もしあわせな気がする　風が木々を揺らすように　笑顔は連鎖して行く　　JOYFUL LOVE　愛はいつだって　wowow　JOYFUL LOVE　素晴らしい力　wow　　本当のやさしさは　してあげることではなくて　何(なん)にもしなくても　穏やかになれることだろう　　ずっと難しく考えていた　痛みからの立ち直り方　ある日　君を見てるうちに気づいた　今日のことはすぐ忘れた方が　明日(あす)また楽しくなる　　そんな思いやりには　僕はどう返せばいいのか？　辛いことあった時は理屈じゃ解決しない　君が微笑むだけで何だって許せてしまうんだ　まるで木漏れ日のように温かい気持ちになれる　　どんな悲しみだって　そっと包み込んでしまうよ　理由(わけ)なんか言わなくても　すべてをわかってくれる　頬に落ちる涙は　温もりに乾かされるのだろう　僕も笑顔になれたら今より強くなれるね　　JOYFUL WORLD　君に誘われた　WOW WOW　JOYFUL WORLD　美しい光　JOYFUL LOVE　これが恋なのか？　WOW WOW　JOYFUL LOVE　初めての世界　WOW
好きということは…,日向坂46,秋元康,youth case,加部輝・城戸紘志・youth case,古い石段　上り切ったら　油蝉が一斉に鳴く　鬱蒼とした山の神社で待ち合わせしたあの夏の日　僕は大きく深呼吸して　初めての恋に震える気持ち　飲み込んでしまおうとした　　日陰の境内に一人きり　ポツンと立っていた君が　振り向いて微笑んだ　　入道雲　近づいても　一緒にいよう(僕が)　絶対(君を)　ずっと守るから　夕立なら　腕の中に　抱きしめよう(雨が)　降っても僕が濡れればいい　好きということは…　　空のどこかが　光った後で　すぐ近くでゴロゴロ鳴った　木々の葉っぱに雫(しずく)が落ちてやがてバケツの底が抜けた　雨がこんなに大音量でザザーっと降って来ると思わず　ロマンティックな気分だったのに…　　君の左手引っ張って走って　ずぶ濡れになった僕らは　笑うしかなかったよ　　雨雲よ　この想いを　伝えておくれ(君を)　ぎゅっと(腕に)　抱きしめたいんだ　でもどこで　立ち止まれば　いいのだろう？(雨の)　せいで　タイミング掴めない　好きと言えなくて…　　もうこうなったら　開き直って　二人で濡れたまま歩こうじゃないか　何があったって　愛は最強だ　　立ち止まって(見つめながら)　抱きしめ合えば　僕らの世界　　入道雲　近づいても　一緒にいよう(僕が)　絶対(君を)　ずっと守るから　夕立なら　腕の中に　抱きしめよう(雨が)　降っても僕が濡れればいい　好きということは…　　こういうことだろう？
酸っぱい自己嫌悪,日向坂46,秋元康,丸山真由子,丸山真由子,海岸線の錆びたガードレール　潮風にさらされてた月日を思い知る　何度もここを自転車　押して歩いた　制服を着てた君が今も待ってるようで…　　東京の大学　受けるって言われて　どうしてあの時　僕は不機嫌に　背中向けたまま　帰ったのだろう　　君が見てた夢を一緒に　応援すればよかった　離れるのが寂しくて　反対したんだ　僕は思い出すよ今でも　がっかりさせた自分を…　誰にもきっとあるのだろう　青春時代の　酸っぱい自己嫌悪　　君からLINE何度かもらったけれど　謝りたいことばかり　未送信のまま…　　新しい彼氏は　理解ある人がいい　素直に思うよ　君の幸せを　遠い空の下　祈り続けてる　　僕もやっと夢を見つけた　まだ手に届かないけれど　決心する大切さと　勇気がわかった　君が聞きたかった言葉は　引き留める愛じゃなくて　待ってるって言葉だった　今さら　ごめんね　ほろ苦い自己嫌悪　　君が見てた夢を一緒に　応援すればよかった　離れるのが寂しくて　反対したんだ　僕は思い出すよ今でも　がっかりさせた自分を…　誰にもきっとあるのだろう　青春時代の　酸っぱい自己嫌悪
青春の馬,日向坂46,秋元康,近藤圭一,近藤圭一,君はどんな夢見てるか？　何も語らずに…　どんな辛い坂道さえ　全力で(立ち止まることなく)　走ってく　青春の馬　　自分の力とは　どうやって測ればいい？　誰かと比較したところでわからないだろう　どこまでできるか予測していた以上に　思いも寄らない可能性　試したくなる　　無謀と言われて　笑われてもいい　立てなくなるまで　走り続けたい　本能のままに生きて行く　　君は絶対諦めるな　何があったって…　足を止めちゃ　そこで終わる　もう走り出せない　夢が叶う　叶わないかは　ずっと先のことだ　今は何も考えずに　無我夢中(ひたすらまっすぐに)　目指すんだ　青春の馬　　Yeah　Yeah　駆け巡れ！　　見えない未来とは　どうやって見つけるんだ？　この道　進んで行けばいいと誰も言わない　何度も間違えて　結局　遠回りして　疲れた身体(からだ)が何かを覚えてくはず　　楽しちゃ意味ない　汗かくしかない　乱れた呼吸が　情熱の証(あかし)　不器用なくらいがむしゃらに…　　君はずっと信じるんだ　いつか見たあの夢　目を開けても　消えない夢　現実の世界だ　そこに行けば　何があるか　誰もわからない　辿り着いたその瞬間　考えが(欲しかったものまで)　変わるのさ　青春の馬　　夜が明けて行く　遠い地平線の彼方　世界はこんなに広かったと知った　蒼ざめた馬が大地を駆け抜けて行く　希望の光を浴びながら　　君はどんな夢見てるか？　何も語らずに…　どんな辛い坂道さえ　全力で走ってく　　君は絶対諦めるな　何があったって…　足を止めちゃ　そこで終わる　もう走り出せない　夢が叶う　叶わないかは　ずっと先のことだ　今は何も考えずに　無我夢中(ひたすらまっすぐに)　目指すんだ　青春の馬　　チャレンジしなくちゃ　生きてる甲斐ない　どこまで行けるか？　走り続けよう　　Never give up！ Never give up！　The easy way has no meaning
